{
  "run_id": "pybughive_hard_smoke_pybughive_black_132_reflexion_seed1",
  "task_id": "pybughive_black_132",
  "method": "reflexion",
  "model": "gpt-5.3-codex",
  "temperature": 0.0,
  "budget": {
    "max_turns": 30,
    "max_tokens": 60000,
    "max_cycles": 10
  },
  "final_outcome": {
    "solved": true,
    "final_test_passed": true,
    "full_test_passed": true,
    "broke_existing_tests": false,
    "timeout": false,
    "cycles_used": 2,
    "llm_turns": 9,
    "tool_calls": 7,
    "input_tokens": 46367,
    "output_tokens": 0,
    "prompt_overhead_tokens": 375,
    "active_debugging_tokens": 45992,
    "failed_patch_count": 0
  },
  "cycles": [
    {
      "cycle_id": 1,
      "diagnosis": "Trailing commas were dropped in split complex literals containing unpacking because DOUBLESTAR incorrectly forced trailing_comma_safe=false outside call/signature contexts.",
      "file_inspections": [
        {
          "path": "black.py",
          "reason": "Inspect delimiter split and delimiter classification logic controlling trailing comma insertion/removal."
        },
        {
          "path": "tests/expression.py",
          "reason": "Confirm failing scenarios involve starred/double-starred unpacking in multiline literals."
        },
        {
          "path": "tests/test_black.py",
          "reason": "Identify exact failing assertions and expected formatting behavior."
        }
      ],
      "patch_attempt": {
        "modified_files": [
          "black.py"
        ],
        "patch_path": null,
        "patch_summary": "Adjusted delimiter_split trailing comma safety check to apply only for STAR/DOUBLESTAR in call/signature-related parent nodes, and fixed operator-precedence leakage by grouping STAR/DOUBLESTAR condition."
      },
      "test_rerun": {
        "command": "wsl.exe -d Ubuntu-24.04 --exec /bin/bash -lc '...; pipenv run python -m unittest tests.test_black.BlackTestCase.test_expression_ff tests.test_black.BlackTestCase.test_piping_diff'",
        "passed": true,
        "log_path": ""
      },
      "mistakes": []
    },
    {
      "cycle_id": 2,
      "diagnosis": "Behavioral fix passed narrow tests, but self-format idempotence failed due to non-canonical line wrapping in edited condition.",
      "file_inspections": [
        {
          "path": "black.py",
          "reason": "Locate style-only mismatch causing test_black/test_piping failures after functional fix."
        }
      ],
      "patch_attempt": {
        "modified_files": [
          "black.py"
        ],
        "patch_path": "runs/pybughive_hard_smoke/pybughive_hard_smoke_pybughive_black_132_reflexion_seed1/agent.patch",
        "patch_summary": "Applied formatting-only adjustment to condition layout so the file is stable under Black's own formatter."
      },
      "test_rerun": {
        "command": "wsl.exe -d Ubuntu-24.04 --exec /bin/bash -lc '...; pipenv run python setup.py test'",
        "passed": true,
        "log_path": "runs/pybughive_hard_smoke/pybughive_hard_smoke_pybughive_black_132_reflexion_seed1/final_test.log"
      },
      "mistakes": [
        {
          "type": "agent_reported_mistake",
          "description": "Initial patch formatting was not idempotent under repository formatter expectations."
        }
      ]
    }
  ],
  "negative_transfer": {
    "detected": false,
    "category": null,
    "reason": null
  }
}
