{
  "run_id": "pybughive_heldout_memory_baselines_pybughive_discord_py_7818_auto_skill_seed1",
  "task_id": "pybughive_discord_py_7818",
  "method": "auto_skill",
  "model": "gpt-5.3-codex",
  "temperature": 0.0,
  "budget": {
    "max_turns": 30,
    "max_tokens": 60000,
    "max_cycles": 10
  },
  "final_outcome": {
    "solved": true,
    "final_test_passed": true,
    "full_test_passed": true,
    "broke_existing_tests": false,
    "timeout": false,
    "cycles_used": 2,
    "llm_turns": 8,
    "tool_calls": 10,
    "input_tokens": 76694,
    "output_tokens": 0,
    "prompt_overhead_tokens": 759,
    "active_debugging_tokens": 75935,
    "failed_patch_count": 1
  },
  "cycles": [
    {
      "cycle_id": 1,
      "diagnosis": "Cog instantiation was reusing class-level nested group objects when parent was explicitly set, so the child group was not rebound onto the cog instance.",
      "file_inspections": [
        {
          "path": "tests/test_app_commands_group.py",
          "reason": "Confirm expected invariants for nested groups and cog attribute rebinding."
        },
        {
          "path": "discord/ext/commands/cog.py",
          "reason": "Inspect cog app-command copy/binding path during instance construction."
        },
        {
          "path": "discord/app_commands/commands.py",
          "reason": "Inspect Group construction/copy logic and parent-child registration."
        }
      ],
      "patch_attempt": {
        "modified_files": [
          "discord/ext/commands/cog.py"
        ],
        "patch_path": null,
        "patch_summary": "Added explicit rebinding logic for nested groups declared on a cog class to the copied instance tree."
      },
      "test_rerun": {
        "command": "pipenv run pytest -- tests/test_app_commands_group.py",
        "passed": false,
        "log_path": ""
      },
      "mistakes": [
        {
          "type": "agent_reported_mistake",
          "description": "Patched cog rebinding before fixing the missing parent-child registration invariant in Group initialization."
        }
      ]
    },
    {
      "cycle_id": 2,
      "diagnosis": "Group(parent=...) did not register itself into the parent's child mapping at construction, so nested groups were not copied with their parent.",
      "file_inspections": [
        {
          "path": "discord/app_commands/commands.py",
          "reason": "Verify Group.__init__ behavior for explicit parent and where child registration should occur."
        }
      ],
      "patch_attempt": {
        "modified_files": [
          "discord/app_commands/commands.py"
        ],
        "patch_path": "runs/pybughive_heldout_memory_baselines/pybughive_heldout_memory_baselines_pybughive_discord_py_7818_auto_skill_seed1/agent.patch",
        "patch_summary": "Updated Group.__init__ to call parent.add_command(self) when a parent is provided, enforcing proper parent-child registration and nested copy behavior."
      },
      "test_rerun": {
        "command": "pipenv run pytest -- tests/test_app_commands_group.py; pipenv run pytest",
        "passed": true,
        "log_path": "runs/pybughive_heldout_memory_baselines/pybughive_heldout_memory_baselines_pybughive_discord_py_7818_auto_skill_seed1/final_test.log"
      },
      "mistakes": []
    }
  ],
  "negative_transfer": {
    "detected": false,
    "category": null,
    "reason": null
  }
}
