{
  "run_id": "pybughive_heldout_memory_baselines_pybughive_black_185_raw_trajectory_retrieval_seed1",
  "task_id": "pybughive_black_185",
  "method": "raw_trajectory_retrieval",
  "model": "gpt-5.3-codex",
  "temperature": 0.0,
  "budget": {
    "max_turns": 30,
    "max_tokens": 60000,
    "max_cycles": 10
  },
  "final_outcome": {
    "solved": true,
    "final_test_passed": true,
    "full_test_passed": true,
    "broke_existing_tests": false,
    "timeout": false,
    "cycles_used": 1,
    "llm_turns": 13,
    "tool_calls": 12,
    "input_tokens": 53669,
    "output_tokens": 0,
    "prompt_overhead_tokens": 928,
    "active_debugging_tokens": 52741,
    "failed_patch_count": 0
  },
  "cycles": [
    {
      "cycle_id": 1,
      "diagnosis": "Singleton parenthesized from-import retained a trailing comma, producing `from logging import ERROR,` instead of `from logging import ERROR`.",
      "file_inspections": [
        {
          "path": "tests/import_spacing.py",
          "reason": "Confirm failing input/output expectation for import spacing behavior."
        },
        {
          "path": "black.py",
          "reason": "Inspect import formatting and parentheses normalization logic in `visit_import_from`."
        }
      ],
      "patch_attempt": {
        "modified_files": [
          "black.py"
        ],
        "patch_path": "runs/pybughive_heldout_memory_baselines/pybughive_heldout_memory_baselines_pybughive_black_185_raw_trajectory_retrieval_seed1/agent.patch",
        "patch_summary": "In `visit_import_from`, remove trailing comma from singleton `import_as_names` before optional parentheses normalization so `from x import (y,)` formats to `from x import y`."
      },
      "test_rerun": {
        "command": "wsl.exe -d Ubuntu-24.04 --exec /bin/bash -lc '...; cd <PROJECT_ROOT>/workspaces/runs/pybughive_heldout_memory_baselines/pybughive_heldout_memory_baselines_pybughive_black_185_raw_trajectory_retrieval_seed1/repo; pipenv run python -m unittest tests.test_black.BlackTestCase.test_import_spacing'",
        "passed": true,
        "log_path": "runs/pybughive_heldout_memory_baselines/pybughive_heldout_memory_baselines_pybughive_black_185_raw_trajectory_retrieval_seed1/final_test.log"
      },
      "mistakes": [
        {
          "type": "invalid_test_command",
          "description": "Initial narrow attempt `pipenv run pytest tests/import_spacing.py -q` failed because the fixture file is not a standalone test module."
        }
      ]
    }
  ],
  "negative_transfer": {
    "detected": false,
    "category": null,
    "reason": null
  }
}
