{
  "run_id": "pybughive_hard_smoke_pybughive_black_132_generic_checklist_seed1",
  "task_id": "pybughive_black_132",
  "method": "generic_checklist",
  "model": "gpt-5.3-codex",
  "temperature": 0.0,
  "budget": {
    "max_turns": 30,
    "max_tokens": 60000,
    "max_cycles": 10
  },
  "final_outcome": {
    "solved": true,
    "final_test_passed": true,
    "full_test_passed": true,
    "broke_existing_tests": false,
    "timeout": false,
    "cycles_used": 3,
    "llm_turns": 9,
    "tool_calls": 14,
    "input_tokens": 119311,
    "output_tokens": 0,
    "prompt_overhead_tokens": 411,
    "active_debugging_tokens": 118900,
    "failed_patch_count": 2
  },
  "cycles": [
    {
      "cycle_id": 1,
      "diagnosis": "Trailing comma safety logic in delimiter splitting likely mis-evaluates `**` due to boolean precedence, causing comma removal in complex literals.",
      "file_inspections": [
        {
          "path": "black.py",
          "reason": "Failure points to trailing comma behavior; inspect delimiter split and trailing comma removal code paths."
        },
        {
          "path": "tests/test_black.py",
          "reason": "Identify narrow failing tests and expected formatting behavior."
        },
        {
          "path": "tests/expression.py",
          "reason": "Inspect concrete examples where trailing commas are expected/preserved."
        }
      ],
      "patch_attempt": {
        "modified_files": [
          "black.py"
        ],
        "patch_path": null,
        "patch_summary": "Parenthesized STAR/DOUBLESTAR condition in `delimiter_split` so `**` no longer bypasses bracket-depth guard."
      },
      "test_rerun": {
        "command": "pipenv run python -m unittest tests.test_black.BlackTestCase.test_expression tests.test_black.BlackTestCase.test_expression_ff tests.test_black.BlackTestCase.test_function tests.test_black.BlackTestCase.test_piping_diff",
        "passed": false,
        "log_path": ""
      },
      "mistakes": []
    },
    {
      "cycle_id": 2,
      "diagnosis": "STAR/DOUBLESTAR guard is still too broad; it should not block trailing commas for list/dict unpacking contexts.",
      "file_inspections": [
        {
          "path": "black.py",
          "reason": "Refine context for where py36 gating should apply."
        }
      ],
      "patch_attempt": {
        "modified_files": [
          "black.py"
        ],
        "patch_path": null,
        "patch_summary": "Restricted py36 trailing-comma safety gate to STAR/DOUBLESTAR under `arglist`/`typedargslist`."
      },
      "test_rerun": {
        "command": "pipenv run python -m unittest tests.test_black.BlackTestCase.test_expression tests.test_black.BlackTestCase.test_expression_ff tests.test_black.BlackTestCase.test_function tests.test_black.BlackTestCase.test_piping_diff",
        "passed": false,
        "log_path": ""
      },
      "mistakes": [
        {
          "type": "agent_reported_mistake",
          "description": "Initial scope missed that `**kwargs` in calls can be parented by `argument`, not only `arglist`."
        }
      ]
    },
    {
      "cycle_id": 3,
      "diagnosis": "Function-call `**kwargs` still treated as comma-safe because parent node type `argument` was not included in the py36 gate.",
      "file_inspections": [
        {
          "path": "black.py",
          "reason": "Adjust parent-type filter to include call argument nodes."
        }
      ],
      "patch_attempt": {
        "modified_files": [
          "black.py"
        ],
        "patch_path": "runs/pybughive_hard_smoke/pybughive_hard_smoke_pybughive_black_132_generic_checklist_seed1/agent.patch",
        "patch_summary": "Extended py36 gate parent types to include `syms.argument`, preserving no-trailing-comma behavior for pre-3.6 call unpacking while keeping commas in list/dict literals."
      },
      "test_rerun": {
        "command": "narrow: pipenv run python -m unittest tests.test_black.BlackTestCase.test_expression tests.test_black.BlackTestCase.test_expression_ff tests.test_black.BlackTestCase.test_function tests.test_black.BlackTestCase.test_piping_diff; full: pipenv run python setup.py test",
        "passed": true,
        "log_path": "runs/pybughive_hard_smoke/pybughive_hard_smoke_pybughive_black_132_generic_checklist_seed1/final_test.log"
      },
      "mistakes": []
    }
  ],
  "negative_transfer": {
    "detected": false,
    "category": null,
    "reason": null
  }
}
