{
  "run_id": "heldout_memory_baselines_local_whitespace_title_bug_auto_skill_seed1",
  "task_id": "local_whitespace_title_bug",
  "method": "auto_skill",
  "model": "gpt-5.3-codex",
  "temperature": 0.0,
  "budget": {
    "max_turns": 30,
    "max_tokens": 60000,
    "max_cycles": 10
  },
  "final_outcome": {
    "solved": true,
    "final_test_passed": true,
    "full_test_passed": true,
    "broke_existing_tests": false,
    "timeout": false,
    "cycles_used": 1,
    "llm_turns": 7,
    "tool_calls": 5,
    "input_tokens": 13081,
    "output_tokens": 0,
    "prompt_overhead_tokens": 307,
    "active_debugging_tokens": 12774,
    "failed_patch_count": 0
  },
  "cycles": [
    {
      "cycle_id": 1,
      "diagnosis": "Whitespace-only input is stripped to an empty string, and title_or_default returns that empty string instead of the default title.",
      "file_inspections": [
        {
          "path": "tests/test_title.py",
          "reason": "Confirm the failing assertion for whitespace-only input and the expected behavior for normal titles."
        },
        {
          "path": "src/text_title/title.py",
          "reason": "Inspect the implementation branch that handles None, whitespace-only, and regular title input."
        }
      ],
      "patch_attempt": {
        "modified_files": [
          "src/text_title/title.py"
        ],
        "patch_path": "runs/heldout_memory_baselines/heldout_memory_baselines_local_whitespace_title_bug_auto_skill_seed1/agent.patch",
        "patch_summary": "Changed the whitespace-only branch to return the provided default instead of an empty string."
      },
      "test_rerun": {
        "command": "python -m pytest tests/test_title.py::test_whitespace_title_uses_default -q",
        "passed": true,
        "log_path": "runs/heldout_memory_baselines/heldout_memory_baselines_local_whitespace_title_bug_auto_skill_seed1/final_test.log"
      },
      "mistakes": []
    }
  ],
  "negative_transfer": {
    "detected": false,
    "category": null,
    "reason": null
  }
}
