{
  "run_id": "pybughive_hard_smoke_pybughive_black_183_reflexion_seed1",
  "task_id": "pybughive_black_183",
  "method": "reflexion",
  "model": "gpt-5.3-codex",
  "temperature": 0.0,
  "budget": {
    "max_turns": 30,
    "max_tokens": 60000,
    "max_cycles": 10
  },
  "final_outcome": {
    "solved": true,
    "final_test_passed": true,
    "full_test_passed": true,
    "broke_existing_tests": false,
    "timeout": false,
    "cycles_used": 1,
    "llm_turns": 8,
    "tool_calls": 10,
    "input_tokens": 53506,
    "output_tokens": 0,
    "prompt_overhead_tokens": 375,
    "active_debugging_tokens": 53131,
    "failed_patch_count": 0
  },
  "cycles": [
    {
      "cycle_id": 1,
      "diagnosis": "Redundant nested parentheses in assert condition were not fully normalized, causing unstable formatting (`assert parens is TooMany` became `assert ((parens is TooMany))`).",
      "file_inspections": [
        {
          "path": "tests/expression.py",
          "reason": "Locate failing assert cases and expected formatting behavior in fixture input."
        },
        {
          "path": "tests/expression.diff",
          "reason": "Confirm expected diff output around assert normalization."
        },
        {
          "path": "black.py",
          "reason": "Inspect statement and invisible-parentheses normalization logic affecting assert formatting."
        }
      ],
      "patch_attempt": {
        "modified_files": [
          "black.py"
        ],
        "patch_path": "runs/pybughive_hard_smoke/pybughive_hard_smoke_pybughive_black_183_reflexion_seed1/agent.patch",
        "patch_summary": "Updated `normalize_invisible_parens()` to recursively hide redundant nested atom parentheses in assert context before normal processing, preventing extra visible parens from surviving and restoring stable output."
      },
      "test_rerun": {
        "command": "wsl.exe -d Ubuntu-24.04 --exec /bin/bash -lc 'export PATH=$HOME/.local/bin:$PATH; cd <PROJECT_ROOT>/workspaces/runs/pybughive_hard_smoke/pybughive_hard_smoke_pybughive_black_183_reflexion_seed1/repo; pipenv run python -m unittest tests.test_black.BlackTestCase.test_expression_ff -v' ; wsl.exe -d Ubuntu-24.04 --exec /bin/bash -lc 'export PATH=$HOME/.local/bin:$PATH; export PIP_INDEX_URL=https://pypi.tuna.tsinghua.edu.cn/simple; export PIP_TRUSTED_HOST=pypi.tuna.tsinghua.edu.cn; export PIP_DEFAULT_TIMEOUT=120; export PIPENV_PYPI_MIRROR=https://pypi.tuna.tsinghua.edu.cn/simple; export PIPENV_TIMEOUT=120; cd <PROJECT_ROOT>/workspaces/runs/pybughive_hard_smoke/pybughive_hard_smoke_pybughive_black_183_reflexion_seed1/repo; pipenv run python setup.py test'",
        "passed": true,
        "log_path": "runs/pybughive_hard_smoke/pybughive_hard_smoke_pybughive_black_183_reflexion_seed1/final_test.log"
      },
      "mistakes": [
        {
          "type": "agent_reported_mistake",
          "description": "Initial narrow test attempt used an invalid `setup.py test tests/expression.py` invocation for this runner."
        }
      ]
    }
  ],
  "negative_transfer": {
    "detected": false,
    "category": null,
    "reason": null
  }
}
