{
  "run_id": "pybughive_train_trajectories_pybughive_black_297_no_memory_seed1",
  "task_id": "pybughive_black_297",
  "method": "no_memory",
  "model": "gpt-5.3-codex",
  "temperature": 0.0,
  "budget": {
    "max_turns": 30,
    "max_tokens": 60000,
    "max_cycles": 10
  },
  "final_outcome": {
    "solved": true,
    "final_test_passed": true,
    "full_test_passed": true,
    "broke_existing_tests": false,
    "timeout": false,
    "cycles_used": 1,
    "llm_turns": 7,
    "tool_calls": 10,
    "input_tokens": 0,
    "output_tokens": 0,
    "prompt_overhead_tokens": 0,
    "active_debugging_tokens": 0,
    "failed_patch_count": 0
  },
  "cycles": [
    {
      "cycle_id": 1,
      "diagnosis": "Star-unpacking in tuple/testlist context was treated like unary operator spacing, introducing an extra space after '*'.",
      "file_inspections": [
        {
          "path": "tests/expression.py",
          "reason": "Confirm failing fixture and exact unpacking example `f = 1, *range(10)`."
        },
        {
          "path": "black.py",
          "reason": "Inspect whitespace and vararg/unpacking classification logic controlling spaces after `*`."
        }
      ],
      "patch_attempt": {
        "modified_files": [
          "black.py"
        ],
        "patch_path": "runs/pybughive_train_trajectories/pybughive_train_trajectories_pybughive_black_297_no_memory_seed1/agent.patch",
        "patch_summary": "Added `syms.testlist_star_expr` to `UNPACKING_PARENTS` so starred unpacking in expression lists is recognized as unpacking and formatted without space after `*`."
      },
      "test_rerun": {
        "command": "wsl.exe -d Ubuntu-24.04 --exec /bin/bash -lc '...; pipenv run python -m pytest -q tests/test_black.py -k expression -q' ; wsl.exe -d Ubuntu-24.04 --exec /bin/bash -lc '...; pipenv run python setup.py test'",
        "passed": true,
        "log_path": "runs/pybughive_train_trajectories/pybughive_train_trajectories_pybughive_black_297_no_memory_seed1/final_test.log"
      },
      "mistakes": [
        {
          "type": "invalid_test_command",
          "description": "Initial narrow test attempt used `setup.py test tests/expression.py`, which is invalid for this runner."
        }
      ]
    }
  ],
  "negative_transfer": {
    "detected": false,
    "category": null,
    "reason": null
  }
}
