{
  "run_id": "pybughive_heldout_memory_baselines_pybughive_scrapy_2552_length_matched_reflexion_seed1",
  "task_id": "pybughive_scrapy_2552",
  "method": "length_matched_reflexion",
  "model": "gpt-5.3-codex",
  "temperature": 0.0,
  "budget": {
    "max_turns": 30,
    "max_tokens": 60000,
    "max_cycles": 10
  },
  "final_outcome": {
    "solved": true,
    "final_test_passed": true,
    "full_test_passed": null,
    "broke_existing_tests": null,
    "timeout": false,
    "cycles_used": 1,
    "llm_turns": 7,
    "tool_calls": 5,
    "input_tokens": 20131,
    "output_tokens": 0,
    "prompt_overhead_tokens": 655,
    "active_debugging_tokens": 19476,
    "failed_patch_count": 0
  },
  "cycles": [
    {
      "cycle_id": 1,
      "diagnosis": "Request URL validation only checked for ':' in the URL, so '/foo:bar' was incorrectly accepted as having a scheme.",
      "file_inspections": [
        {
          "path": "tests/test_http_request.py",
          "reason": "Confirm the exact failing assertion and expected behavior for invalid URLs without scheme."
        },
        {
          "path": "scrapy/http/request/__init__.py",
          "reason": "Inspect Request URL validation logic executed by Request/FormRequest/XmlRpcRequest/JsonRequest initialization."
        }
      ],
      "patch_attempt": {
        "modified_files": [
          "scrapy/http/request/__init__.py"
        ],
        "patch_path": "runs/pybughive_heldout_memory_baselines/pybughive_heldout_memory_baselines_pybughive_scrapy_2552_length_matched_reflexion_seed1/agent.patch",
        "patch_summary": "Replaced naive colon-based URL scheme validation with parsed scheme validation using urlparse(self._url).scheme."
      },
      "test_rerun": {
        "command": "wsl.exe -d Ubuntu-24.04 --exec /bin/bash -lc 'export PATH=$HOME/.local/bin:$PATH; export PIP_INDEX_URL=https://pypi.tuna.tsinghua.edu.cn/simple; export PIP_TRUSTED_HOST=pypi.tuna.tsinghua.edu.cn; export PIP_DEFAULT_TIMEOUT=120; export PIPENV_PYPI_MIRROR=https://pypi.tuna.tsinghua.edu.cn/simple; export PIPENV_TIMEOUT=120; cd <PROJECT_ROOT>/workspaces/runs/pybughive_heldout_memory_baselines/pybughive_heldout_memory_baselines_pybughive_scrapy_2552_length_matched_reflexion_seed1/repo; pipenv run pytest tests/test_http_request.py'",
        "passed": true,
        "log_path": "runs/pybughive_heldout_memory_baselines/pybughive_heldout_memory_baselines_pybughive_scrapy_2552_length_matched_reflexion_seed1/final_test.log"
      },
      "mistakes": []
    }
  ],
  "negative_transfer": {
    "detected": false,
    "category": null,
    "reason": null
  }
}
