{
  "run_id": "pybughive_hard_format_shuffled_first6_pybughive_black_132_format_shuffled_skill_seed1",
  "task_id": "pybughive_black_132",
  "method": "format_shuffled_skill",
  "model": "gpt-5.5",
  "temperature": 0.0,
  "budget": {
    "max_turns": 30,
    "max_tokens": 60000,
    "max_cycles": 10
  },
  "final_outcome": {
    "solved": true,
    "final_test_passed": true,
    "full_test_passed": true,
    "broke_existing_tests": false,
    "timeout": false,
    "cycles_used": 2,
    "llm_turns": 1,
    "tool_calls": 18,
    "input_tokens": 107759,
    "output_tokens": 0,
    "prompt_overhead_tokens": 700,
    "active_debugging_tokens": 107059,
    "failed_patch_count": 1
  },
  "cycles": [
    {
      "cycle_id": 1,
      "diagnosis": "Split collection displays and existing multiline dict/list bodies were losing or failing to add expected trailing commas because the formatter stripped commas when appending closing brackets and treated collection unpacking like function-call unpacking.",
      "file_inspections": [
        {
          "path": "logs/initial_failure.txt",
          "reason": "Attempted to read the provided failure log, but it was absent in the prepared checkout."
        },
        {
          "path": "tests/expression.py",
          "reason": "Inspected neighboring input and expected output cases for list, dict, call, and multiline mapping trailing-comma behavior."
        },
        {
          "path": "tests/function.py",
          "reason": "Checked related trailing-comma fixture context for function formatting behavior."
        },
        {
          "path": "black.py",
          "reason": "Inspected Line.maybe_remove_trailing_comma and delimiter_split, the direct owners of comma removal and split comma insertion."
        }
      ],
      "patch_attempt": {
        "modified_files": [
          "black.py"
        ],
        "patch_path": null,
        "patch_summary": "Preserved trailing commas while building lines already inside brackets and limited star/unpack trailing-comma suppression to call arglists."
      },
      "test_rerun": {
        "command": "wsl.exe -d Ubuntu-24.04 --exec /bin/bash -lc 'export PATH=$HOME/.local/bin:$PATH; export PIP_INDEX_URL=https://pypi.tuna.tsinghua.edu.cn/simple; export PIP_TRUSTED_HOST=pypi.tuna.tsinghua.edu.cn; export PIP_DEFAULT_TIMEOUT=120; export PIPENV_PYPI_MIRROR=https://pypi.tuna.tsinghua.edu.cn/simple; export PIPENV_TIMEOUT=120; cd <PROJECT_ROOT>/workspaces/runs/pybughive_hard_format_shuffled_first6/pybughive_hard_format_shuffled_first6_pybughive_black_132_format_shuffled_skill_seed1/repo; pipenv run python setup.py test'",
        "passed": false,
        "log_path": ""
      },
      "mistakes": [
        {
          "type": "agent_reported_mistake",
          "description": "Used invalid PowerShell Select-Object range syntax while sampling fixture lines."
        },
        {
          "type": "agent_reported_mistake",
          "description": "The first unpacking predicate only checked the immediate parent and did not catch call **kwargs under an argument node."
        }
      ]
    },
    {
      "cycle_id": 2,
      "diagnosis": "The call case still received a generated trailing comma because **kwargs in a call is represented as a DOUBLESTAR leaf under an argument node whose parent is arglist.",
      "file_inspections": [
        {
          "path": "black.py",
          "reason": "Inspected and patched the delimiter_split predicate after probing the local parse tree for call(a, **kwargs)."
        }
      ],
      "patch_attempt": {
        "modified_files": [
          "black.py"
        ],
        "patch_path": "runs/pybughive_hard_format_shuffled_first6/pybughive_hard_format_shuffled_first6_pybughive_black_132_format_shuffled_skill_seed1/agent.patch",
        "patch_summary": "Extended the arglist detection to include STAR/DOUBLESTAR leaves whose immediate parent is syms.argument and grandparent is syms.arglist."
      },
      "test_rerun": {
        "command": "wsl.exe -d Ubuntu-24.04 --exec /bin/bash -lc 'export PATH=$HOME/.local/bin:$PATH; export PIP_INDEX_URL=https://pypi.tuna.tsinghua.edu.cn/simple; export PIP_TRUSTED_HOST=pypi.tuna.tsinghua.edu.cn; export PIP_DEFAULT_TIMEOUT=120; export PIPENV_PYPI_MIRROR=https://pypi.tuna.tsinghua.edu.cn/simple; export PIPENV_TIMEOUT=120; cd <PROJECT_ROOT>/workspaces/runs/pybughive_hard_format_shuffled_first6/pybughive_hard_format_shuffled_first6_pybughive_black_132_format_shuffled_skill_seed1/repo; pipenv run python setup.py test'",
        "passed": true,
        "log_path": "runs/pybughive_hard_format_shuffled_first6/pybughive_hard_format_shuffled_first6_pybughive_black_132_format_shuffled_skill_seed1/final_test.log"
      },
      "mistakes": [
        {
          "type": "agent_reported_mistake",
          "description": "Several inline WSL Python parse probes had shell quoting errors before using a simpler local input."
        }
      ]
    }
  ],
  "negative_transfer": {
    "detected": false,
    "category": null,
    "reason": null
  }
}
