{
  "run_id": "pybughive_heldout_memory_baselines_pybughive_black_1493_format_shuffled_skill_seed1",
  "task_id": "pybughive_black_1493",
  "method": "format_shuffled_skill",
  "model": "gpt-5.3-codex",
  "temperature": 0.0,
  "budget": {
    "max_turns": 30,
    "max_tokens": 60000,
    "max_cycles": 10
  },
  "final_outcome": {
    "solved": true,
    "final_test_passed": true,
    "full_test_passed": true,
    "broke_existing_tests": false,
    "timeout": false,
    "cycles_used": 2,
    "llm_turns": 6,
    "tool_calls": 10,
    "input_tokens": 48228,
    "output_tokens": 0,
    "prompt_overhead_tokens": 700,
    "active_debugging_tokens": 47528,
    "failed_patch_count": 1
  },
  "cycles": [
    {
      "cycle_id": 1,
      "diagnosis": "find_project_root computed a lexicographic minimum path instead of a true common ancestor, so it selected src/ and returned the wrong pyproject root.",
      "file_inspections": [
        {
          "path": "tests/test_black.py",
          "reason": "Confirm expected behavior for project root selection across sibling directories."
        },
        {
          "path": "src/black/__init__.py",
          "reason": "Inspect find_project_root implementation and marker-search loop."
        }
      ],
      "patch_attempt": {
        "modified_files": [
          "src/black/__init__.py"
        ],
        "patch_path": null,
        "patch_summary": "Replaced lexicographic min(Path.resolve()) base selection with Path(os.path.commonpath(...)) to compute the real common root before scanning for .git/.hg/pyproject.toml."
      },
      "test_rerun": {
        "command": "pipenv run pytest -- tests/test_black.py",
        "passed": false,
        "log_path": ""
      },
      "mistakes": [
        {
          "type": "agent_reported_mistake",
          "description": "Initial patch changed behavior correctly but violated repository formatting expectation in self-format test."
        }
      ]
    },
    {
      "cycle_id": 2,
      "diagnosis": "Behavioral fix was correct; remaining failures were formatting-only in Black's source self-check.",
      "file_inspections": [
        {
          "path": "src/black/__init__.py",
          "reason": "Adjust patched line to formatting expected by tests."
        }
      ],
      "patch_attempt": {
        "modified_files": [
          "src/black/__init__.py"
        ],
        "patch_path": "runs/pybughive_heldout_memory_baselines/pybughive_heldout_memory_baselines_pybughive_black_1493_format_shuffled_skill_seed1/agent.patch",
        "patch_summary": "Converted multi-line Path(os.path.commonpath(...)) assignment into the expected single-line form without changing logic."
      },
      "test_rerun": {
        "command": "pipenv run pytest -- tests/test_black.py",
        "passed": true,
        "log_path": "runs/pybughive_heldout_memory_baselines/pybughive_heldout_memory_baselines_pybughive_black_1493_format_shuffled_skill_seed1/final_test.log"
      },
      "mistakes": []
    }
  ],
  "negative_transfer": {
    "detected": false,
    "category": null,
    "reason": "Full suite passed after fix (pipenv run pytest)."
  }
}
