{
  "run_id": "pilot_memory_baselines_local_empty_input_bug_raw_trajectory_retrieval_seed1",
  "task_id": "local_empty_input_bug",
  "method": "raw_trajectory_retrieval",
  "model": "manual-smoke-agent",
  "temperature": 0.0,
  "budget": {
    "max_turns": 30,
    "max_tokens": 60000,
    "max_cycles": 10
  },
  "final_outcome": {
    "solved": true,
    "final_test_passed": true,
    "full_test_passed": true,
    "broke_existing_tests": false,
    "timeout": false,
    "cycles_used": 1,
    "llm_turns": 4,
    "tool_calls": 6,
    "input_tokens": 1102,
    "output_tokens": 46,
    "prompt_overhead_tokens": 269,
    "active_debugging_tokens": 879,
    "failed_patch_count": 0
  },
  "cycles": [
    {
      "cycle_id": 1,
      "diagnosis": "The failing assertion indicates an unhandled empty-input branch in the directly responsible parser behavior.",
      "file_inspections": [
        {
          "path": "src/sample_parser/parser.py",
          "reason": "This implementation owns the behavior exercised by the failing test."
        }
      ],
      "patch_attempt": {
        "modified_files": [
          "src/sample_parser/parser.py"
        ],
        "patch_path": "runs/pilot_memory_baselines/pilot_memory_baselines_local_empty_input_bug_raw_trajectory_retrieval_seed1/cycle_1.patch",
        "patch_summary": "Return an empty list for whitespace-only input instead of returning None."
      },
      "test_rerun": {
        "command": "python -m pytest tests/test_parser.py::test_empty_input_returns_empty_list -q",
        "passed": true,
        "log_path": "runs/pilot_memory_baselines/pilot_memory_baselines_local_empty_input_bug_raw_trajectory_retrieval_seed1/cycle_1.log"
      },
      "mistakes": []
    }
  ],
  "negative_transfer": {
    "detected": false,
    "category": null,
    "reason": null
  }
}
