{
  "run_id": "pybughive_heldout_memory_baselines_pybughive_discord_py_7818_generic_checklist_seed1",
  "task_id": "pybughive_discord_py_7818",
  "method": "generic_checklist",
  "model": "gpt-5.3-codex",
  "temperature": 0.0,
  "budget": {
    "max_turns": 30,
    "max_tokens": 60000,
    "max_cycles": 10
  },
  "final_outcome": {
    "solved": true,
    "final_test_passed": true,
    "full_test_passed": true,
    "broke_existing_tests": false,
    "timeout": false,
    "cycles_used": 3,
    "llm_turns": 11,
    "tool_calls": 10,
    "input_tokens": 39095,
    "output_tokens": 0,
    "prompt_overhead_tokens": 411,
    "active_debugging_tokens": 38684,
    "failed_patch_count": 2
  },
  "cycles": [
    {
      "cycle_id": 1,
      "diagnosis": "Nested app command group attribute with explicit parent is not rebound to cog instance; class-level object leaks through.",
      "file_inspections": [
        {
          "path": "tests/test_app_commands_group.py",
          "reason": "Read failing assertion and expected nested group behavior."
        },
        {
          "path": "discord/ext/commands/cog.py",
          "reason": "Inspect cog metaclass collection and cog instance command copying path."
        },
        {
          "path": "discord/app_commands/commands.py",
          "reason": "Inspect Group/Command copy semantics and parent-child structure."
        }
      ],
      "patch_attempt": {
        "modified_files": [
          "discord/ext/commands/cog.py"
        ],
        "patch_path": null,
        "patch_summary": "Added nested app-command rebinding logic in Cog.__new__ using a copied-command lookup keyed by qualified_name and walk traversal."
      },
      "test_rerun": {
        "command": "pipenv run pytest -- tests/test_app_commands_group.py",
        "passed": false,
        "log_path": ""
      },
      "mistakes": [
        {
          "type": "agent_reported_mistake",
          "description": "Used non-existent qualified_name on app_commands.Group/Command, causing broad AttributeError failures."
        }
      ]
    },
    {
      "cycle_id": 2,
      "diagnosis": "Lookup strategy needed to map original app command objects to copied objects without qualified_name support.",
      "file_inspections": [
        {
          "path": "discord/app_commands/commands.py",
          "reason": "Verified _copy_with signatures and available attributes for Group and Command."
        },
        {
          "path": "discord/ext/commands/cog.py",
          "reason": "Refined mapping logic to use recursive original->copy object mapping."
        }
      ],
      "patch_attempt": {
        "modified_files": [
          "discord/ext/commands/cog.py"
        ],
        "patch_path": null,
        "patch_summary": "Replaced qualified_name-based lookup with recursive object identity mapping across copied top-level app commands and child trees."
      },
      "test_rerun": {
        "command": "pipenv run pytest -- tests/test_app_commands_group.py",
        "passed": false,
        "log_path": ""
      },
      "mistakes": [
        {
          "type": "agent_reported_mistake",
          "description": "Assumed explicitly parented nested group would already exist in parent _children copy tree."
        }
      ]
    },
    {
      "cycle_id": 3,
      "diagnosis": "Explicitly parented nested groups declared as class attributes are not always present in copied top-level trees and must be copied/attached explicitly when parent copy exists.",
      "file_inspections": [
        {
          "path": "discord/ext/commands/cog.py",
          "reason": "Implement fallback copy/attach for unmapped nested app command attributes."
        }
      ],
      "patch_attempt": {
        "modified_files": [
          "discord/ext/commands/cog.py"
        ],
        "patch_path": "runs/pybughive_heldout_memory_baselines/pybughive_heldout_memory_baselines_pybughive_discord_py_7818_generic_checklist_seed1/agent.patch",
        "patch_summary": "Added fallback in Cog.__new__: for nested app command attributes with copied parent but no mapping, call _copy_with(parent=mapped_parent, binding=self), attach to parent _children, and bind attribute on cog instance."
      },
      "test_rerun": {
        "command": "pipenv run pytest",
        "passed": true,
        "log_path": "runs/pybughive_heldout_memory_baselines/pybughive_heldout_memory_baselines_pybughive_discord_py_7818_generic_checklist_seed1/final_test.log"
      },
      "mistakes": []
    }
  ],
  "negative_transfer": {
    "detected": false,
    "category": null,
    "reason": null
  }
}
