{
  "run_id": "pybughive_hard_smoke_pybughive_black_132_no_memory_seed1",
  "task_id": "pybughive_black_132",
  "method": "no_memory",
  "model": "gpt-5.3-codex",
  "temperature": 0.0,
  "budget": {
    "max_turns": 30,
    "max_tokens": 60000,
    "max_cycles": 10
  },
  "final_outcome": {
    "solved": true,
    "final_test_passed": true,
    "full_test_passed": true,
    "broke_existing_tests": false,
    "timeout": false,
    "cycles_used": 3,
    "llm_turns": 17,
    "tool_calls": 22,
    "input_tokens": 133137,
    "output_tokens": 0,
    "prompt_overhead_tokens": 0,
    "active_debugging_tokens": 133137,
    "failed_patch_count": 1
  },
  "cycles": [
    {
      "cycle_id": 1,
      "diagnosis": "Trailing comma suppression in delimiter splitting was applied too broadly for unpacking, removing commas in multiline literals.",
      "file_inspections": [
        {
          "path": "black.py",
          "reason": "Locate delimiter splitting and trailing comma safety logic."
        },
        {
          "path": "tests/expression.py",
          "reason": "Confirm failing examples involve *more/**kwargs trailing commas."
        },
        {
          "path": "tests/expression.diff",
          "reason": "Verify expected output retains trailing commas in complex literals."
        }
      ],
      "patch_attempt": {
        "modified_files": [
          "black.py"
        ],
        "patch_path": null,
        "patch_summary": "Restricted trailing-comma py36 safety gate to unpacking contexts in signatures/calls instead of all stars/doublestars, preserving commas in list/dict displays."
      },
      "test_rerun": {
        "command": "pipenv run python setup.py test",
        "passed": false,
        "log_path": ""
      },
      "mistakes": [
        {
          "type": "agent_reported_mistake",
          "description": "Initial condition still allowed an unwanted call-site trailing comma after **kwargs."
        },
        {
          "type": "agent_reported_mistake",
          "description": "Condition formatting drift caused temporary self-format test mismatch."
        }
      ]
    },
    {
      "cycle_id": 2,
      "diagnosis": "**kwargs in function call still received trailing comma; parent node type needed to include argument context for gating.",
      "file_inspections": [
        {
          "path": "black.py",
          "reason": "Inspect AST parent types around VARARGS handling and delimiter split behavior."
        }
      ],
      "patch_attempt": {
        "modified_files": [
          "black.py"
        ],
        "patch_path": null,
        "patch_summary": "Extended star/doublestar gating to include syms.argument and adjusted condition layout."
      },
      "test_rerun": {
        "command": "pipenv run python -m unittest tests.test_black.BlackTestCase.test_expression_ff tests.test_black.BlackTestCase.test_piping_diff -v",
        "passed": true,
        "log_path": ""
      },
      "mistakes": [
        {
          "type": "agent_reported_mistake",
          "description": "Ran formatting and tests in parallel once, causing a race and misleading failure in test_black."
        }
      ]
    },
    {
      "cycle_id": 3,
      "diagnosis": "Self-format test required canonical formatting of black.py after logic edits.",
      "file_inspections": [
        {
          "path": "tests/test_black.py",
          "reason": "Confirm test_black asserts source is already formatted."
        },
        {
          "path": "black.py",
          "reason": "Apply final canonical formatting with project formatter."
        }
      ],
      "patch_attempt": {
        "modified_files": [
          "black.py"
        ],
        "patch_path": "runs/pybughive_hard_smoke/pybughive_hard_smoke_pybughive_black_132_no_memory_seed1/agent.patch",
        "patch_summary": "Ran project formatter on black.py to satisfy self-format idempotence after functional fix."
      },
      "test_rerun": {
        "command": "pipenv run python setup.py test",
        "passed": true,
        "log_path": "runs/pybughive_hard_smoke/pybughive_hard_smoke_pybughive_black_132_no_memory_seed1/final_test.log"
      },
      "mistakes": []
    }
  ],
  "negative_transfer": {
    "detected": false,
    "category": null,
    "reason": null
  }
}
