{
  "run_id": "pybughive_train_trajectories_pybughive_discord_py_7676_no_memory_seed1",
  "task_id": "pybughive_discord_py_7676",
  "method": "no_memory",
  "model": "gpt-5.3-codex",
  "temperature": 0.0,
  "budget": {
    "max_turns": 30,
    "max_tokens": 60000,
    "max_cycles": 10
  },
  "final_outcome": {
    "solved": true,
    "final_test_passed": true,
    "full_test_passed": true,
    "broke_existing_tests": false,
    "timeout": false,
    "cycles_used": 1,
    "llm_turns": 6,
    "tool_calls": 6,
    "input_tokens": 20212,
    "output_tokens": 0,
    "prompt_overhead_tokens": 0,
    "active_debugging_tokens": 20212,
    "failed_patch_count": 0
  },
  "cycles": [
    {
      "cycle_id": 1,
      "diagnosis": "Timezone-aware explicit task times were compared against `now` in a different timezone/date context, causing wrong next-slot selection near UTC/local day boundaries.",
      "file_inspections": [
        {
          "path": "tests/test_ext_tasks.py",
          "reason": "Inspect failing regression expectations and input construction for issue 7676."
        },
        {
          "path": "discord/ext/tasks/__init__.py",
          "reason": "Inspect `_get_next_sleep_time` and `_start_time_relative_to` scheduling logic."
        }
      ],
      "patch_attempt": {
        "modified_files": [
          "discord/ext/tasks/__init__.py"
        ],
        "patch_path": "runs/pybughive_train_trajectories/pybughive_train_trajectories_pybughive_discord_py_7676_no_memory_seed1/agent.patch",
        "patch_summary": "In `_start_time_relative_to`, converted `now` into each scheduled time's timezone before computing date and comparing, ensuring correct next explicit time selection across timezone boundaries."
      },
      "test_rerun": {
        "command": "pipenv run pytest -- tests/test_ext_tasks.py",
        "passed": true,
        "log_path": "runs/pybughive_train_trajectories/pybughive_train_trajectories_pybughive_discord_py_7676_no_memory_seed1/final_test.log"
      },
      "mistakes": []
    }
  ],
  "negative_transfer": {
    "detected": false,
    "category": null,
    "reason": null
  }
}
