{
  "run_id": "pybughive_heldout_memory_baselines_pybughive_scrapy_2552_generic_checklist_seed1",
  "task_id": "pybughive_scrapy_2552",
  "method": "generic_checklist",
  "model": "gpt-5.3-codex",
  "temperature": 0.0,
  "budget": {
    "max_turns": 30,
    "max_tokens": 60000,
    "max_cycles": 10
  },
  "final_outcome": {
    "solved": true,
    "final_test_passed": true,
    "full_test_passed": null,
    "broke_existing_tests": null,
    "timeout": false,
    "cycles_used": 1,
    "llm_turns": 6,
    "tool_calls": 7,
    "input_tokens": 27754,
    "output_tokens": 0,
    "prompt_overhead_tokens": 411,
    "active_debugging_tokens": 27343,
    "failed_patch_count": 0
  },
  "cycles": [
    {
      "cycle_id": 1,
      "diagnosis": "Request URL validation only checked for ':' anywhere in the string, so '/foo:bar' was incorrectly treated as having a scheme.",
      "file_inspections": [
        {
          "path": "tests/test_http_request.py",
          "reason": "Read failing assertion and expected invalid URL behavior."
        },
        {
          "path": "scrapy/http/request/__init__.py",
          "reason": "Locate Request URL initialization and scheme validation logic."
        }
      ],
      "patch_attempt": {
        "modified_files": [
          "scrapy/http/request/__init__.py"
        ],
        "patch_path": "runs/pybughive_heldout_memory_baselines/pybughive_heldout_memory_baselines_pybughive_scrapy_2552_generic_checklist_seed1/agent.patch",
        "patch_summary": "Imported urlparse and replaced colon-presence check with parsed-scheme check (`if not urlparse(self._url).scheme`) to correctly reject '/foo:bar' as missing scheme."
      },
      "test_rerun": {
        "command": "wsl.exe -d Ubuntu-24.04 --exec /bin/bash -lc 'export PATH=$HOME/.local/bin:$PATH; export PIP_INDEX_URL=https://pypi.tuna.tsinghua.edu.cn/simple; export PIP_TRUSTED_HOST=pypi.tuna.tsinghua.edu.cn; export PIP_DEFAULT_TIMEOUT=120; export PIPENV_PYPI_MIRROR=https://pypi.tuna.tsinghua.edu.cn/simple; export PIPENV_TIMEOUT=120; cd <PROJECT_ROOT>/workspaces/runs/pybughive_heldout_memory_baselines/pybughive_heldout_memory_baselines_pybughive_scrapy_2552_generic_checklist_seed1/repo; pipenv run pytest tests/test_http_request.py'",
        "passed": true,
        "log_path": "runs/pybughive_heldout_memory_baselines/pybughive_heldout_memory_baselines_pybughive_scrapy_2552_generic_checklist_seed1/final_test.log"
      },
      "mistakes": []
    }
  ],
  "negative_transfer": {
    "detected": false,
    "category": null,
    "reason": null
  }
}
