{
  "run_id": "pybughive_hard_smoke_pybughive_black_234_auto_skill_seed1",
  "task_id": "pybughive_black_234",
  "method": "auto_skill",
  "model": "gpt-5.5",
  "temperature": 0.0,
  "budget": {
    "max_turns": 30,
    "max_tokens": 60000,
    "max_cycles": 10
  },
  "final_outcome": {
    "solved": true,
    "final_test_passed": true,
    "full_test_passed": true,
    "broke_existing_tests": false,
    "timeout": false,
    "cycles_used": 2,
    "llm_turns": 1,
    "tool_calls": 25,
    "input_tokens": 73324,
    "output_tokens": 0,
    "prompt_overhead_tokens": 759,
    "active_debugging_tokens": 72565,
    "failed_patch_count": 1
  },
  "cycles": [
    {
      "cycle_id": 1,
      "diagnosis": "Long from-import star statements were being given optional invisible parentheses, so line splitting made invalid parenthesized star imports; fmt-off import statements were also still having explicit parentheses hidden before unformatted mode took over.",
      "file_inspections": [
        {
          "path": "tests/import_spacing.py",
          "reason": "Confirmed the expected behavior for long star imports and neighboring normal import splitting cases."
        },
        {
          "path": "tests/fmtonoff.py",
          "reason": "Confirmed that an import inside a fmt-off block must preserve explicit parentheses exactly."
        },
        {
          "path": "tests/test_black.py",
          "reason": "Located the failing unittest methods and their formatting/equivalence assertions."
        },
        {
          "path": "black.py",
          "reason": "Inspected LineGenerator.visit_import_from, unformatted traversal, import line detection, and bracket split logic that owns optional import parentheses."
        }
      ],
      "patch_attempt": {
        "modified_files": [
          "black.py"
        ],
        "patch_path": null,
        "patch_summary": "Skipped custom import parenthesis normalization when already in UnformattedLines and avoided optional parentheses for from-import star statements."
      },
      "test_rerun": {
        "command": "wsl.exe -d Ubuntu-24.04 --exec /bin/bash -lc 'export PATH=$HOME/.local/bin:$PATH; export PIP_INDEX_URL=https://pypi.tuna.tsinghua.edu.cn/simple; export PIP_TRUSTED_HOST=pypi.tuna.tsinghua.edu.cn; export PIP_DEFAULT_TIMEOUT=120; export PIPENV_PYPI_MIRROR=https://pypi.tuna.tsinghua.edu.cn/simple; export PIPENV_TIMEOUT=120; cd <PROJECT_ROOT>/workspaces/runs/pybughive_hard_smoke/pybughive_hard_smoke_pybughive_black_234_auto_skill_seed1/repo; pipenv run python -m unittest tests.test_black.BlackTestCase.test_import_spacing tests.test_black.BlackTestCase.test_fmtonoff'",
        "passed": false,
        "log_path": ""
      },
      "mistakes": [
        {
          "type": "agent_reported_mistake",
          "description": "The first fmt-off guard checked only the current output line state, but the fmt-off marker can be in the import node prefix before UnformattedLines is active."
        }
      ]
    },
    {
      "cycle_id": 2,
      "diagnosis": "The remaining fmt-off failure happened because visit_import_from mutated parentheses before the leaf-level FormatOff transition was raised from the node prefix.",
      "file_inspections": [
        {
          "path": "black.py",
          "reason": "Compared visit_import_from with normalize_invisible_parens, which already checks generate_comments(node) for FormatOff before mutating parentheses."
        }
      ],
      "patch_attempt": {
        "modified_files": [
          "black.py"
        ],
        "patch_path": "runs/pybughive_hard_smoke/pybughive_hard_smoke_pybughive_black_234_auto_skill_seed1/agent.patch",
        "patch_summary": "Added a FormatOff prefix guard in visit_import_from before modifying import parentheses, preserving explicit parentheses inside fmt-off blocks."
      },
      "test_rerun": {
        "command": "wsl.exe -d Ubuntu-24.04 --exec /bin/bash -lc 'export PATH=$HOME/.local/bin:$PATH; export PIP_INDEX_URL=https://pypi.tuna.tsinghua.edu.cn/simple; export PIP_TRUSTED_HOST=pypi.tuna.tsinghua.edu.cn; export PIP_DEFAULT_TIMEOUT=120; export PIPENV_PYPI_MIRROR=https://pypi.tuna.tsinghua.edu.cn/simple; export PIPENV_TIMEOUT=120; cd <PROJECT_ROOT>/workspaces/runs/pybughive_hard_smoke/pybughive_hard_smoke_pybughive_black_234_auto_skill_seed1/repo; pipenv run python setup.py test'",
        "passed": true,
        "log_path": "runs/pybughive_hard_smoke/pybughive_hard_smoke_pybughive_black_234_auto_skill_seed1/final_test.log"
      },
      "mistakes": []
    }
  ],
  "negative_transfer": {
    "detected": false,
    "category": null,
    "reason": null
  }
}
