{
  "run_id": "pybughive_hard_smoke_pybughive_black_133_no_memory_seed1",
  "task_id": "pybughive_black_133",
  "method": "no_memory",
  "model": "gpt-5.3-codex",
  "temperature": 0.0,
  "budget": {
    "max_turns": 30,
    "max_tokens": 60000,
    "max_cycles": 10
  },
  "final_outcome": {
    "solved": false,
    "final_test_passed": false,
    "full_test_passed": false,
    "broke_existing_tests": false,
    "timeout": false,
    "cycles_used": 3,
    "llm_turns": 8,
    "tool_calls": 11,
    "input_tokens": 48074,
    "output_tokens": 0,
    "prompt_overhead_tokens": 0,
    "active_debugging_tokens": 48074,
    "failed_patch_count": 2
  },
  "cycles": [
    {
      "cycle_id": 1,
      "diagnosis": "Failure is caused by lambda expression reformatting splitting at a comma in lambda varargs, changing expected output in expression tests.",
      "file_inspections": [
        {
          "path": "black.py",
          "reason": "Inspect whitespace and delimiter split logic for lambda/varargs handling."
        },
        {
          "path": "tests/expression.py",
          "reason": "Confirm failing lambda case and expected formatted shape."
        }
      ],
      "patch_attempt": {
        "modified_files": [
          "black.py"
        ],
        "patch_path": null,
        "patch_summary": "Disabled split-after-comma delimiter priority for commas inside syms.varargslist (lambda args)."
      },
      "test_rerun": {
        "command": "pipenv run python -m unittest tests.test_black.BlackTestCase.test_expression tests.test_black.BlackTestCase.test_expression_ff tests.test_black.BlackTestCase.test_piping_diff",
        "passed": true,
        "log_path": ""
      },
      "mistakes": []
    },
    {
      "cycle_id": 2,
      "diagnosis": "Full suite still failed due formatting snapshot diffs in black.py from inserted standalone comment layout, not behavior regression.",
      "file_inspections": [
        {
          "path": "black.py",
          "reason": "Remove formatting-impacting standalone comment while preserving behavior."
        }
      ],
      "patch_attempt": {
        "modified_files": [
          "black.py"
        ],
        "patch_path": null,
        "patch_summary": "Converted standalone comment to inline comment to reduce formatting drift."
      },
      "test_rerun": {
        "command": "pipenv run python setup.py test",
        "passed": false,
        "log_path": ""
      },
      "mistakes": []
    },
    {
      "cycle_id": 3,
      "diagnosis": "Remaining full-suite diffs were still formatting-only in black.py around return expression shape.",
      "file_inspections": [
        {
          "path": "black.py",
          "reason": "Refactor return statement form to minimize formatter-induced differences while keeping logic."
        }
      ],
      "patch_attempt": {
        "modified_files": [
          "black.py"
        ],
        "patch_path": "runs/pybughive_hard_smoke/pybughive_hard_smoke_pybughive_black_133_no_memory_seed1/agent.patch",
        "patch_summary": "Refactored comma handling return into conditional expression; narrow tests remained green; full suite still had 2 formatting snapshot failures."
      },
      "test_rerun": {
        "command": "pipenv run python setup.py test",
        "passed": false,
        "log_path": "runs/pybughive_hard_smoke/pybughive_hard_smoke_pybughive_black_133_no_memory_seed1/final_test.log"
      },
      "mistakes": []
    }
  ],
  "negative_transfer": {
    "detected": false,
    "category": null,
    "reason": null
  }
}
